hole_number,from_m,to_m,base_lithology,litho_detailed,lith_general,lith_grain_size,lith_texture1,lith_texture2,lith_texture3,lith_description
AXE-23-001,0.0,2.0,OVB,OVB,,,,,,OVERBURDEN
AXE-23-001,2.0,6.0,CL,CL,NC,,,,,"TOP OF BEDROCK REACHED AT 2M, NO RECOVERY UNTIL 6M"
AXE-23-001,6.0,17.0,DIO,DIO,SVI,FMG,XEN,SER,POR,"MED-LIGHT GREY DIORITE. SOME SUB-ROUNDED CLASTS (VOLCANOCLASTIC?) IN SPOTS UP TO 6CM. GROUNDMASS IS MOSTLY FINE-MED GRAINED, SUBVOLCANIC LOOKING WITH POSSIBLE QUENCHING ZONES THAT LOOK TO HAVE SOME LAYERING/FLOW BANDING. SMALL PLAG PHENOS AVG 1MM AND ACTINOLITE/CHLORITE ALTERED ACICULAR HORNBLENDE PHENOS AVG 1.5MM THROUGHOUT. WK-STR MAGNETIC WITH TINY BLEBS OF MAGNETITE THROUGHOUT."
AXE-23-001,,,,,,,,,,
AXE-23-001,17.0,21.07,DIO,DIO,VCB,FMG,POR,XEN,,"LIGHT GREEN-GREY AND MED RED VOLCANOCLASTIC DIRORITE. CHAOTIC VOLCANOCLASTIC/BRECCIATED LOOK TO THE ROCK, MANY FRAGMENTS WITH SOME LIGHT GREY-GREEN COLOURED AND OTHERS RED HEM STAINED. RED HEM STAINED ROCK MIGHT BE A MATRIX OF SOME SORT, COULD BE RHYOLITE IN ORIGIN. SOME ALTERED PALG AND HORNBLENDE TEXTURE SLIGHTLY VISIBLE, UP TO 2MM PHENOS WHERE VISIBLE. CLASTS IN ROCK ARE AROUND A COUPLE CMS AVERAGE. SOME PATCHES OF WK MAG."
AXE-23-001,21.07,23.14,DIO,DIO,SVI,MG,POR,PSBX,MEL,"LIGHT-DARK GREEN DIORITE. HIGHLY ALTERED DIORITE WITH MAGNETITE AND EP, POSSIBLY SUB-VOLCANIC, POSSIBLE VOLCANOCLASTIC. SOME VISIBLE PHENOS AVG 1MM OF PLAG AND HORNBLENDE. A SMALL ZONE OF WHAT COULD BE A DYKLET OR A XENOLITH OF THE RED HEM STAINED ROCKTYPE SEEN ABOVE WITH CALCITE VEINING. HIGHLY MAGNETIC THROUGHOUT."
AXE-23-001,23.14,26.35,DIO,DIO,VCB,FMG,XEN,POR,,"MED GREY AND RED VOLCANOCLASTIC/BRECCIATED DIORITE. SIMILAR TO THE UNIT ABOVE THE MAGNETITE/EPIDOTE ALTERED UNIT. THE RED POSSIBLY RHYOLITE ROCK SEEMS TO HAVE SOME ZONES WHERE THEY ARE ALL GOING IN THE SAME DIECTION LIKE LAYERING, ~45 DTCA, COULD BE DUE TO PRESSURE INJECTING THE FLUID THROUGH THE DIORITE. TOP CONTACT LOOKS TO BE ~28 DTCA. ALT LOOKS MORE PHYLLIC THAN BEFORE, OTHER THAN THE RED HEM. MOSTLY NO-MAG TO WK MAG WITH SOME MODERATE PATCHES."
AXE-23-001,,,,,,,,,,
AXE-23-001,26.35,44.0,FBX,FBX,FLT,FMG,XEN,POR,,INTENSLY ALTERED AND FAULTED GREEN-BLACK DIORITE. UNIT STARTS OFF LOOKING SIMILAR TO THE EP/MAG ALTERED DIORITE ABOVE BUT BECOMES EVEN MORE INTENSELY ALTERED TO GREEN AND BLACK FROM 29-35 WITH SOME FAULTED ZONES OF RUBBLE AND GOUGE. SOME TEXTURE IS PRESEREVED SHOWING FINE-MED GRAINED DIORITE WITH SMALL 1MM PLAG AND HORNBLENDE PHENOS.
AXE-23-001,,,,,,,,,,
AXE-23-001,44.0,55.0,CL,CL,NC,,,,,"CORE LOSS IN FAULTY MATERIAL, DRILLER HAD TO RE-COLLAR TO 57M, ONLY ~2M RECOVERED FROM 44-57M WHICH IS PROBABLY THE LAST BIT OF ROCK PULLED UP."
AXE-23-001,55.0,59.0,AND,AND,FLT,FMG,XEN,POR,,"ZONE OF HEAVILY FAULTED ANDESITE AND POSSIBLE DIORITE, MED GREY WITH SOME LIGHT GREEN. HIGHLY FAULTED AND COULD BE ANDESITE WITH FRAGMENTS/BX OF DIORITE-MICRODIORITE. MOD-STR MAG THROUGHOUT IN PATCHES."
AXE-23-001,59.0,60.05,AND,AND,DYK,FG,AMG,,,MED GREY FINE GRAINED ANDESITE DYKE. SOME SPARCE CAL AND EP FILLED AMYGDULES. WK-MOD MAG.
AXE-23-001,60.05,71.2,AND,AND,FLT,FMG,XEN,POR,,SAME AS ABOVE THE ANDESITE DYKE.
AXE-23-001,71.2,79.25,AND,AND,DYK,FG,AMG,MEL,,MED GREY FINE GRAINED ANDESITE DYKE. MOSTLY FINE GRAINED WITH SOME SPOTTY ACT ALTERED HORNBLENDE MACULES OCCASIONALLY SEEN (MELANOCRATIC). SOME WHITE SPOTS OF CALCITE THAT COULD BE SPARCE AMYGDULES. WK-MOD MAG.
AXE-23-001,79.25,101.05,DIO,DIO,VCB,FMG,XEN,POR,SER,"MED GREY DIORITE WITH SOME BRECCIATED AND SUBVOLCANIC. PLAG AND HORNBLENDE PHENOS THROUGHOUT UP TO 2MM, HORNBLENDE LOOKING USUALLY SMALLER THAN PLAG. LOOKS LESS FAULTED THAN FAULTING ABOVE ANDESITE BUT STILL VERY FRACTURED/BROKEN. SOME SECTIONS WITH STRONG BRECCIATION, DIORITE CLASTS FLOATING IN SLIGHTLY FINER GRAINED MATRIX. SOME ZONES THAT LOOK TO HAVE FLOW BANDING AND/OR DEFORMATION CAUSING UNDULATORY LAYERS. WK PCHY MAG OCCASIONALLY WITH SOME SLIGHTLY MOD MAG. SOME SPOTS WITH A TINY ORANGE/BROWN MINERAL THAT ISN'T VERY HARD, HAS A SLIGHT CLEAVAGE, POSSIBLY ELONGATE SPHENE SHAPE, DOTTED IN THE GROUNDMASS, POSSIBLE TITANITE. THERE APPEARS TO BE A SMALL 25CM ANDESITE DYKLET WITH AMYGDULES AT 94.65-94,90M THAT LOOKS JUST LIKE THE OTHER ANDESITE DYKES ENCOUNTERED IN THE HOLE."
AXE-23-001,101.05,102.42,AND,AND,DYK,FG,CHL,POR,AMG,MED-DARK GREY ANDESITE DYKE. FINE GRAINED WITH SOME ACT/CHL ALTERED HORNBLENDE PHENOS UP TO 3MM. CHILL MARGINS ON THE TOP AND BOTTOM OF UNIT WITH NO PHENOS AND FINER GROUNDMASS. SMALL ~1MM CALCITE FILLED AMYGDULES THROUGHOUT. MOD MAGNETISM THROUGHOUT. BOTTOM CONTACT IS APPROX 45 DTCA.
AXE-23-001,102.42,154.02,DIO,DIO,VCB,FMG,POR,XEN,,"MED-DARK GREY-GREEN DIORITE. HEAVILY FRACTURED AND FAULTED, SOME THINGS HARD TO SEE IN ROCK. LOOKS SLIGHTLY VOLCANOCLASTIC WITH SOME SUB-ROUNDED CLASTS IN GROUNDMASS BUT NOT ENOUGH TO BE BRECCIA. FINE-MED GRAINED, PLAG AND HORNBLENDE PHENOS UP TO ~2MM IN SIZE. STRONG PROP ALT SEEMS TO BE MAKING ROCK SOFT AND BRITTLE THROUGHOUT. MOD-STR PATCHES OF MAG THROUGHOUT WITH SOME UN-MAGNETIC ROCK. THERE IS ONE SMALL ANDESITE DYKLET AT ~137.10M (DIFFICULT TO TELL WHERE IT STARTS OR END IN THE BROKEN ROCK), ~15CM LONG. LAST ~1M HAS MAGNETITE AND EPIDOTE IN SOME OF THE FAULT RUBBLE"
AXE-23-001,,,,,,,,,,
AXE-23-001,154.02,156.42,AND,AND,DYK,FG,POR,CHL,,DARK GREY ANDESITE DYKE. FINE GRAINED WITH SOME ACT ALTERED HORNBLENDE PHENOS UP TO 4MM. CHILLED MARGINS AT TOP AND BOTTOM. CAL FILLED AMYGDULES.
AXE-23-001,156.42,162.8,MM,MM,FLT,FMG,MEL,,,"BLACK MAGNETITE SKARN ALTERED ROCK WITH SOME GREEN. ROCK HAS BEEN COMPLETELY ALTERED AND REPLACED WITH MOSTLY MAGNETITE AND SOME EPIDOTE. SOME PATCHES OF PROP MINERALS CAN BE SEEN BUT ALL TEXTURE HAS BEEN DESTROYED AND THE ROCK IS MOSTLY SANDY. THE ROCK IS RUBBLY FROM FAULTING PROBABLY. SOME LARGE VNS AND BLEBS OF CPY THROUGHOUT. SHARP TOP CONTACT BETWEEN ANDESITE AND SKARN IS INTACT, 39 DTCA."
AXE-23-001,162.8,227.5,DIO,DIO,VCB,FMG,XEN,POR,,"LIGHT-MED GREY-GREEN VOLCANOCLASTIC DIORITE. VARIEGATED COLOUR BETWEEN GREY AND GREEN EP. MUCH OF ROCK IS BROKEN UP AND FLTED. CHAOTIC LOOKING BRECCIATION IN INTACT PIECES, MANY LITH TYPES, DIORITE PIECES WITH SOME ANDESITE, POSSIBLE RHYOLITE AND/OR MONZONITE, FRAGS OF THE MAGNETITE SKARN LOOKING MATERIAL, MANY SUB-ROUNDED WITH A FEW SLIGHTLY ANGULAR, AVG SIZE IS A FEW CMS. MUCH OF TEXTURE IS OBSCURED BY ALT AND RUBBLE, SOME PLAG AND HORNBLENDE PHENOS VISIBLE UP TO 2MM. PATCHY WK-MOD MAG THROUGHOUT, SOME SPOTS WITH NO MAG. A SMALL ANDESITE DYKE IS FOUND AT 219.70-219.92M THAT LOOKS LIKE THE OTHERS PREVIOUSLY SEEN."
AXE-23-001,,,,,,,,,,
AXE-23-001,227.5,233.26,AND,AND,DYK,FG,XEN,POR,CHL,"MED-DARK GREY-GREEN TUFFACEOUS TO VOLCANIC ANDESITE. THIS UNIT LOOKS LIKE IT COULD BE TWO TYPES OF VOLCANIC ROCK OR DYKES; THE TOP FROM 227.5-229M IS UNUSUALLY LOW IN SIO2 (FROM XRF, ~40%) WHICH MAKES IT NEARLY BASALTIC IN COMPOSITION. THE TOP OF THE UNIT ALSO DISPLAYS WHAT LOOKS LIKE TUFFACEOUS TEXTURES LIKE FLOW BANDING/DEFORMATION WITH GLASSY WHITE TABULAR CLASTS OR PHENOS (PLAG?) UP TO 4MM AND EUTAXTIC VEINING (UNDULATORY/DEFORMED VEINING AROUND THE CLASTS/CRYSTALS) BUT IT ALSO HAS SIMILAR PORPHYRITIC HORNBLENDE THROUGHOUT LIKE THE ONE BELOW OR THE DYKES SEEN EARLIER IN THE HOLE. THE GROUNDMASS IS FINE WITH CHL/ACT ALT THROUGHOUT AND MANY SMALL BLEBS OF HEMATITE-MAGNETITE. TOP AND BOTTOM OF THIS SECTION IS BROKEN UP AND MIGHT HAVE CORE LOSS SO IT IS UNCLEAR IF THERE COULD BE CHILL MARGINS. FROM 229~230.85M MAY BE INCORPORATED ROCK FROM THE DIORITE OR MORE MESSED UP VOLCANICS/DYKE MATERIAL BUT IT'S UNCLEAR DUE TO FLTING AND RUBBLE. FROM ~230.85-233.26M THE ROCK LOOKS MUCH MORE LIKE THE ANDESITE DYKES SEEN BEFORE WITH PORPHYRITIC HORNBLENDE REPLACED BY HORNBLENDE AND CONTAINING CAL AMYGDULES. THERE ARE CHILL MARGINS AT THE START AND END OF THIS ""TRUE"" ANDESITE. WK-MOD MAG THROUGHOUT EXCEPT THROUGH THE MIDDLE SECTION WHERE THERE IS TRACE-WK MAGNETISM."
AXE-23-001,,,,,,,,,,
AXE-23-001,,,,,,,,,,
AXE-23-001,233.26,249.3,DIO,DIO,VCB,FMG,XEN,POR,,MED GREY-DARK GREEN VOLCANOCLASTIC/BRECCIATED DIORITE. SIMILAR TO THE UNIT ABOVE THE DYKE WITH POLYMICTIC CLASTS/BRECCIA COMPOSITION. WK MAG THROUGHOUT WITH SOME MOD PATCHES.
AXE-23-001,249.3,254.0,DIO,DIO,VCB,FMG,XEN,MEL,,"DARK GREEN TO BLACK SKARN ALTERED ROCK. SOME SPOTS HAVE SLIGHTLY LESS SKARN ALT AND SEEM TO LOOK LIKE A DIORITE LIKE ABOVE, SO IS PROBABLY THE PROTOLITH. ROCK IS MOSTLY JUST FINE GRAINED ACTINOLITE AND MAGNETITE WITH EP AND SPOTS OF BROWN-RED GARNETS (ANDRADITE?) THAT LOOK SLIGHTLY DECOMPOSED. THE DIORITE LOOKING SECTIONS HAVE SOME MED GRAINED CRYSTALS VISIBLE. MOD-INTENSE MAGNETISM, ESPECIALLY IN THE BLACK MAGNETITE SECTION."
AXE-23-001,,,,,,,,,,
AXE-23-001,254.0,256.65,DIO,DIO,VCB,FMG,XEN,POR,,"LIGHT GREEN-GREY DIORITE. POSSIBLY BRECCIATED, HARD TO SEE ANY TEXTURE IN INTENSE PROPYLITIC ALT AND MOST IS BROKEN INTO SMALL PIECES. ROCK IS COMPOSED MOSTLY OF WHAT LOOKS LIKE CHLORITE, SERICITE, AND CALCITE GROUNDMASS WITH DARK GREEN SPOTS THAT ARE PROBABLY ACTINOLITE REPLACING HORNBLENDE THAT LOOK UP TO 3MM IN SIZE. NO MAGNETISM."
AXE-23-001,256.65,260.35,MM,MM,FLT,FMG,MEL,,,"BLACK TO DARK GREEN MAGNETITE SKARN. ALMOST COMPLETELY COMPOSED OF MAGNETITE AND SOME ACTINOLITE. PROTOLITH COULD BE FAULTED VOLCANICS DUE TO HOW RUBBLY AND GOUGY THE ROCK LOOKS, AND THE BOTTOM LOOKS LIKE GOUGE FAULTS. TEXTURE IS LIKE A SILTY CLAY WITH SANDY MATERIAL"
AXE-23-001,260.35,276.48,DIO,DIO,VCB,FMG,XEN,POR,,"LIGHT GREEN VOLCANOCLASTIC/BRECCIATED DIORITE. MOST OF UNIT IS RUBBLE SO TEXTURES AND FEATURES ARE HARD TO SEE. SOME INTACT ZONES HAVE CLASTS OF POSSIBLY DIORITE AND OTHER ROCK TYPES UP TO 4CM. GROUNDMASS IS QUITE CARBONACEOUS, MOSTLY COMPOSED OF WHAT LOOKS LIKE CHL CAL SER AND ACT. POSSIBLE PHENOS OF HORNBLENDE THAT HAVE BEEN REPLACED BY SER AND/OR CAL UP TO 2MM. WK PCHY MAG THROUGHOUT."
AXE-23-001,,,,,,,,,,
AXE-23-001,276.48,277.65,AND,AND,DYK,FG,POR,CHL,AMG,"MED GREY-GREEN ANDESITE DYKE. SIMILAR TO THE OTHER ANDESITE DYKES SEEN THROUGHOUT THE HOLE. PORPHYRITIC 2MM HORNBLENDE REPLACED BY ACTINOLITE, LESS AND SMALLER CAL FILLED AMYGDULES. MOD MAG, BUT NO BIOTITE THIS TIME. LESS PHENOS AND FINER GRAINED AT TOP AND BOTTOM, CHILL MARGIN."
AXE-23-001,277.65,284.55,DIO,DIO,VCB,FMG,XEN,POR,,MED GREEN-GREY BECCIATED DIORITE. CHAOTIC LOOKING TEXTURE WITH SOME DEFORMATION. SOME PORPH TEXTURE SEEN IN SOME ROCK WITH MANY CLASTS OF POSSIBLY ANDESITE/DIORITE ORIGIN. SOME LOOKS TO HAVE LAYERING FROM EITHER DEFORMATION METAMORPHISM OR FLOW BANDING. OF PHENOS SEEN IT LOOKS LIKE ALTERED PLAG AND HORNBLENDE ~2MM IN SIZE. WK-MOD PCHY MAG THROUGHOUT.
AXE-23-001,284.55,285.55,AND,AND,DYK,FG,POR,AMG,,"MED GREEN-GREY ANDESITE DYKE. LOOKS SIMILAR TO THE DYKES SEEN THROUGHOUT THE HOLE, EXCEPT THE BLACK SPOTS FROM ABOUT THE MIDDLE AND DOWN ARE LARGER UP TO 8MM AND LOOK MORE LIKE CLASTS. THESE ""CLASTS"" LOOK SUB-ROUNDED TO ANGULAR AND ARE SLIGHTLY MOTTLED BLACK AND WHITE, WHICH COULD BE ACT AND SER OR CHL REPLACING THEM (DARKER ON THE OUTSIDE AND MORE TRANSLUSCENT-GREEN TOWARDS THE INSIDE). MOD MAG THROUGHOUT. NO APPARENT CHILL MARGINS. SLIGHTLY AMYDALOIDAL WITH CAL FILL."
AXE-23-001,285.55,320.35,DIO,DIO,VCB,FMG,XEN,POR,,"LIGHT-MED GREY-GREEN BRECCIATED DIORITE. PLAG AND HORNBLENDE PHENOS ARE VISIBLE, MOSTLY 1MM IN SIZE. CHAOTIC LOOKING BRECCIA CLASTS SEEN THROUGHOUT UP TO A FEW CMS, COMPOSED OF DIORITE AND POSSIBLY ANDESITE. THERE IS WHAT LOOKS LIKE A SMALL ANDESITE DYKE FROM ~290.35-290.75M THAT LOOKS SIMILAR TO THE OTHER DYKES THAT HAVE BEEN SEEN THROUGH THE HOLE. PAST THIS DYKE THE ROCK BECOMES VERY BROKEN AND FAULTED UNTIL ~318M."
AXE-23-001,,,,,,,,,,
AXE-23-001,,,,,,,,,,
AXE-23-001,,,,,,,,,,
AXE-23-001,320.35,323.35,MM,MM,FLT,FMG,MEL,,,BLACK TO DARK GREEN MAGNETITE SKARN. UNIT IS ALMOST COMPLETELY ALTERED TO MAGNETITE SKARN RICH IN ACT MAG AND PY. LOTS OF THE UNIT HAS CLAY AND CRUMBLY ROCK SO MAY HAVE BEEN A FLT OR SERIES OF FLTS. GRAINSIZE IS FROM A FINE CLAY LIKE MAG DUST TO MED GRAINED CRYSTALS. HIGHLY MAGNETIC.
AXE-23-001,323.35,354.3,AND,AND,VCB,FG,XEN,,,"MED-PALE GREEN VOLCANOCLASTIC ANDESITE. ROCK IS CHAOTICALLY FILLED WITH MANY TYPED OF LITH CLASTS THAT ARE MOSTLY SUB-ROUNDED AND HAVING COMPOSITIONS THAT COULD POSSIBLY INCLUDE ANDESITE, DIORITE, RHYOLITE, MONZONITE, AND MAYBE OTHERS. AN XRF SCAN ON SOME BLACK AND LIGHT PINK CLASTS SHOWED THAT EVEN THOUGH THE CLASTS LOOK TO HAVE DIFFERENT MAFIC-TO-FELSIC COMPOSITIONS DUE TO THEIR COLOUR, THEY HAVE VERY HIGH SIO2 CONTENT OF AROUND 80% WHILE HAVING LOW FE AND MG WHICH COULD BE DUE TO SILICIFICATION OF THE ENTIRE UNIT. CLASTS RANGE IN SIZE FROM LESS THAN A CM TO 10 OR MORE CMS. THE MATRIX IS FINE GRAINED ANDESITE. THERE ARE A FEW SMALL SECTIONS THAT SEEM TO HAVE A LOWER CLAST AMOUNT WHICH COULD BE A LULL IN VOLCANIC ACTIVITY, AND ALSO SOME SMALL SECTIONS WHERE THE MATRIX LOOKS LIKE MICRODIORITE."
AXE-23-001,,,,,,,,,,
AXE-23-001,354.3,355.3,AND,AND,DYK,FG,AMG,,,"DARK GREY FINE-GRAINED ANDESITE DYKE. THIS DYKE LOOKS MUCH DIFFERENT THAN THE PREVIOUS DYKES SEEN EARLIER; IT HAS EPIDOTE SPOTS WHICH ARE PROBABLY AMYGDULES, NO PHENOS UNLESS THE EPIDOTE SPOTS ARE ALTERED PHENOS, AND SOME CHALCO BLEBS IN THE GROUNDMASS AND WITH THE EPIDOTE AMYGDULES. THIS DYKE MIGHT HAVE BEEN FORMED EARLIER OR RELATIVELY SYN-VOLCANIC. THERE DOESN'T APPEAR TO BE DEFINITE CHILL MARGINS AND THE CONTACT AT THE TOP DOESN'T LOOK VERY SHARP. MOD MAG THROUGHOUT."
AXE-23-001,355.3,392.25,AND,AND,VCB,FMG,XEN,,,"LIGHT-MED GREY TO GREEN VOLCANOCLASTIC BRECCIA. THIS UNIT IS THE SAME AS THE ONE ABOVE THE DYKE. AROUND ~362M THE ROCK STOP BEING SO BROKEN AND STARTS BEING MUCH MORE COMPETENT; THE BIGGEST CHANGE AROUND THIS AREA IS IT OCCURS RIGHT WHEN GYPSUM VNS START APPEARING SO COULD BE RELATED. SOME SECTIONS HAVE CLASTS THAT ARE QUITE ROUNDED AND PACKED, ALMOST LOOKS LIKE CONGLOMERATE."
AXE-23-001,,,,,,,,,,
AXE-23-001,392.25,393.55,AND,AND,DYK,FG,AMG,CHL,POR,"MED GREY ANDESITE DYKE. FINE-GRAINED, AMYGDULES FILLED WITH CAL, SOME SMALL 1MM PHENOS OF ACT ALTERED HORNBLENDE. WK-MOD MAGNETIC"
AXE-23-001,393.55,423.95,AND,AND,VCB,FMG,XEN,,,"MED-DARK GREY TO GREEN VOLCANOCLASTIC BRECCIA. THIS UNIT IS THE SAME AS THE ONE ABOVE THE DYKE. SOME SECTIONS ONCE AGAIN HAVE CLASTS THAT ARE QUITE ROUNDED AND PACKED, ALMOST LOOKS LIKE CONGLOMERATE. THERE IS ANOTHER SMALL DYKE THAT LOOKS IDENTICAL TO THE ONE ABOVE THIS UNIT AT 395.7-396.05CM."
AXE-23-001,423.95,425.0,AND,AND,DYK,FG,XEN,CHL,POR,"MED GREY ANDESITE DYKE. FINE-GRAINED, CHILL MARGINS AND SOME CLASTS INCORPORATED AT THE EDGES. THE CLASTS HAVE A DISTORTED/LAYERED LOOKING CHILL HALO. ~2MM SIZE PHENOS OF HORNBLENDE ARE ALTERED BY ACT AND HEM. WK-MOD MAGNETISM."
AXE-23-001,425.0,461.75,AND,AND,VCB,FMG,XEN,,,MED-DARK GREY-GREEN VOLCANOCLASTIC ANDESITE. SAME ROCK UNIT AS ABOVE THE ANDESITE DYKE. THERE SEEM TO BE MORE ALTERNATING LIGHT AND DARK PATCHES GOING DOWN SUGGESTING POSSIBLE BI-MODAL VOLCANISM.
AXE-23-001,461.75,462.6,AND,AND,DYK,FG,POR,AMG,CHL,"MED GREY ANDESITE DYKE. FINE GRAINED, AMYDULES FILLED WITH CAL AND SOME WITH HEM BLEBS, CHILL MARGINS AT THE TOP AND BOTTOM. SOME DARKER SPOTS THAT ARE PROBABLY HORNBLENDE PHENOS THAT HAVE BEEN ALTERED WITH ACT AND HEM, LOOK POORLY FORMED. BOTTOM CONTACT IS AT 44 DTCA"
AXE-23-001,462.6,467.24,AND,AND,VCB,FMG,XEN,,,MED-DARK GREY-GREEN VOLCANOCLASTIC ANDESITE. SAME ROCK UNIT AS ABOVE THE ANDESITE DYKE. THERE ARE A COUPLE SMALL ANDESITE DYKLETS UP TO 4CM WIDE CUTIING THROUGH.
AXE-23-001,467.24,470.88,AND,AND,DYK,FG,CHL,AMG,,"MED GREY ANDESITE DYKE. FINE GRAINED AND CAL FILLED AMYGDULES. NO PHENOS IN THIS DYKE, UNLIKE THE OTHERS. CHILLED MARGINS. WK-MOD MAGNETISM."
AXE-23-001,470.88,523.93,AND,AND,VCB,FMG,XEN,,,"MED-DARK GREY-GREEN VOLCANOCLASTIC ANDESITE. SAME ROCK UNIT AS ABOVE THE ANDESITE DYKE. THERE IS A SECTION WHERE THERE ARE NO CLASTS IN THE ROCK AND THE GRAINSIZE STARTS ALTERNATING BETWEEN FINE AND MEDIUM GRAINED FROM 483.03-489.67M. THIS SECTION DOESN'T LOOK LIKE A TYPICAL DYKE AS IT LACKS CHILL MARGINS, THE CONTACTS SEEM MORE GRADATIONAL, AND THE GRAINSIZE CHANGES THROUGHOUT THE INTERVAL, SO IS PROBABLY A SYN-SUBVOLCANIC PHASE OF THE SAME UNIT. BOTTOM OF UNIT IS STILL VOLCANOCLASTIC BUT SEEMS TO GRADATIONALLY HAVE LESS CLASTS IN THE LAST COUPLE METRES"
AXE-23-001,,,,,,,,,,
AXE-23-001,,,,,,,,,,
AXE-23-001,523.93,531.75,AND,AND,SVI,FMG,POR,,,"MED GREY AND GREEN SPOTTED PORPHYRITIC ANDESITE. FINE-MED GRAINED WITH A FINE GROUNDMASS AND MED GRAINED PHENOS OF HORNBLENDE UP TO 3MM IN SIZE. EP IS SPECKLED THROUGHOUT GROUNDMASS, POSSIBLY MANY REPLACING PHENOS. SMALL POSSIBLE ANDESITE DYKE CUTTING THROUGH THE ROCK AT 525.96-526.68M THAT IS DARKER AND FINE GRAINED WITH SMALLER PHENOS, COULD BE SYN-VOLCANIC."
AXE-23-001,531.75,557.94,AND,AND,VCB,FMG,XEN,POR,,"MED-DARK GREY AND RED VOLCANOCLASTIC ANDESITE. LOOKS SIMILAR TO THE OTHER VOLCANOCLASTICS ABOVE; SUB-ROUNDED TO ROUNDED CLASTS THAT LOOK LIKE CONGLOMERATE IN A FINE GRAINED ANDESITE MATRIX, POLYMICTIC CLASTS. MANY CLASTS ARE REDDISH FROM HEM ALT AND/OR MAY HAVE POT ALT."
AXE-23-001,557.94,560.76,AND,AND,DYK,FG,MEL,POR,,"DARK GREY ANDESITE DYKE. FINE GRAINED, NO OBVIOUS CHILL MARGINS. SOME SMALL HORNBLENDE PHENOS IN GROUNDMASS UP TO 1MM."
AXE-23-001,560.76,588.22,AND,AND,VCB,FMG,XEN,POR,,MED GREY TO RED VOLCANOCLASTIC ANDESITE. SAME AS THE ROCK TYPE ABOVE THE DYKE.
AXE-23-001,,,,,,,,,,
AXE-23-001,588.22,589.35,AND,AND,DYK,FG,XEN,CHL,AMG,"LIGHT GREY-RED ANDESITE DYKE. FINE GRAINED, PORPHYRITIC, CAL FILLED AMYGDULES. ONE LARGE XENOLITH 5CM IN SIZE. CHILLED MARGING AT THE EDGES. BOTTOM CONTACT IS AT 39 DTCA"
AXE-23-001,589.35,596.0,AND,AND,VCB,FMG,XEN,POR,,"SAME VOLCANOCLASTIC ANDESITE AS ABOVE DYKE, THE COLOUR IS MORE RED FROM HEM ALT. ANOTHER SMALL DYKLET THAT LOOKS RELATIVELY THE SAME AS THE ONE ABOVE IS GOING THROUGH THE UNIT AT 592.11-592.8M."
AXE-23-001,596.0,599.23,AND,AND,DYK,FG,POR,AMG,,"MED-DARK GREY ANDESITE DYKE. UP TO 2MM HORNBLENDE PHENOS, CAL FILLED AMYGDULES, NO OBVIOUS CHILL MARGINS."
AXE-23-001,599.23,634.37,AND,AND,VCB,FMG,XEN,POR,,MED-DARK GREY TO MAROON RED VOLCANOCLASTIC ANDESITE. SAME VOLCANOCLASTIC ANDESITE AS BEFORE WITH MANY ROUNDED CLASTS AND A FINE-MED GRAINED ANDESITE MATRIX.
AXE-23-001,,,,,,,,,,
AXE-23-001,,,,,,,,,,
AXE-23-001,634.37,651.35,AND,AND,SVI,FMG,TRA,SER,XEN,"MED-DARK GREY ANDESITE. ZONES OF FINE AND MED GRAINED CRYSTALS ARE PRESENT, PROBABLY DUE TO MULTIPHASIC VOLCANIC EVENTS. SOME PHENOS HAVE A TRACHYTIC ALIGNMENT. ~2MM ACICULAR HORNBLENDE PHENOS AND SOME SMALLER PLAG PHENOS OCCASSIONALLY SEEN. RARE SUB-ROUNDED CLASTS SEEN UP TO 4CM IN SIZE. TOP CONTACT LOOKS LIKE IT'S RELATIVELY SHARP WITH POSSIBLE SHEARING ABOVE IT IN THE PREVIOUS UNIT."
AXE-23-001,651.35,683.06,AND,AND,VCB,FMG,XEN,,,DARK-MED GREY GREEN AND RED VOLCANOCLASTIC ANDESITE. THIS UNIT IS PRACTICALLY IDENTICAL TO THE VOLCANOCLASTIC ANDESITE THAT OCCURRED ABOVE THE ANDESITE.
AXE-23-001,,,,,,,,,,
AXE-23-001,683.06,721.53,AND,AND,SVI,FMG,POR,XEN,,"MED-DARK GREY ANDESITE WITH GREEN SPOTS OF EPIDOTE THROUGHOUT. GRAIN SIZE ALTERNATES THROUGHOUT WITH SOME FINE GRAINED AND SOME MED GRAINED. SOME SECTIONS WHERE PLAG AND HORNBLENDE PHENOS ARE UP TO 2MM IN SIZE. SOME SECTIONS HAVE LOTS OF EPIDOTE SPOTTED THROUGHOUT, POSSIBLY REPLACING THE PHENOS THAT WERE THERE. AT ~709-716M THERE ARE VOLCANOCLASTICS THAT LOOK LIKE THE VOLCANOCLASTIC UNIT ABOVE THAT COME IN AND OUT SLIGHTLY, STILL LOOKS MOSTLY LIKE ANDESITE AND IS PROBABLY A SMALL EVENT INBETWEEN ERUPTIONS."
AXE-23-001,,,,,,,,,,
AXE-23-001,,,,,,,,,,
AXE-23-001,721.53,723.45,AND,AND,VCB,FMG,XEN,,,DARK-MED GREY GREEN AND RED VOLCANOCLASTIC ANDESITE. THIS UNIT IS PRACTICALLY IDENTICAL TO THE VOLCANOCLASTIC ANDESITE THAT OCCURRED ABOVE THE ANDESITE ONCE AGAIN.
AXE-23-001,723.45,724.21,AND,AND,DYK,FG,CHL,,,"MED GREY ANDESITE DYKE. FINE GRAINED, CHILL MARGINS AT THE EDGES, NO VISIBLE PHENOS, NO VISIBLE AMYGDULES. TOP CONTACT IS 38 DTCA"
AXE-23-001,724.21,732.0,AND,AND,VCB,FMG,XEN,,,DARK-MED GREY GREEN AND RED VOLCANOCLASTIC ANDESITE. THIS UNIT IS PRACTICALLY IDENTICAL TO THE VOLCANOCLASTIC ANDESITE THAT OCCURRED ABOVE THE ANDESITE DYKE ONCE AGAIN. EOH AT 732M
AXE-23-002,0.0,2.0,OVB,OVB,NC,,,,,"OVERBURDEN, NO CORE RECOVERED"
AXE-23-002,2.0,6.0,CL,CL,NC,,,,,"BEDROCK HIT AT 2M, NO CORE RECOVERED"
AXE-23-002,6.0,41.0,AND,AND,VCB,FMG,XEN,POR,,"MED-DARK GREY VOLCANIC BRECCIA ANDESITE. SOME LARGE CLASTS IN ANDESITE MATRIX UP TO 8CM. ANDESITE IS FINE-MED GRAINED, SOME SECTIONS THAT LOOK LIKE MICRO DIORITE WITH PLAG AND HORNBLENDE PHENOS VISIBLE UP TO ~2MM. SOME FLTING AND BROKEN ROCK MAKING IT DIFFICULT TO SEE TEXTURES IN THE ROCK. WK-MOD MAGNETISM THROUGHOUT IN PATCHES"
AXE-23-002,41.0,55.93,AND,AND,VCB,FMG,XEN,POR,,"LIGHT-DARK GREEN TO BLACK SKARN. PROTOLITH LOOKS TO BE POSSIBLY A VOLCANOCLASTIC ANDESITE OR DIORITE, MOST TEXTURE HAVE BEEN REPLACED BY SKARN MINERALS. SOME SHAPES THAT LOOK LIKE SUB-ROUNDED CLASTS OCCASSIONALY SEEN. SOME SECTIONS WITH LOTS OF GARNETS REPLACING MOST OF THE ORIGINAL ROCK"
AXE-23-002,55.93,86.95,AND,AND,VCB,FMG,XEN,POR,,"LIGHT-MED GREY AND GREEN VOLCANOCLASTIC ANDESITE. FINE-MED GRAINED THROUGHOUT WITH SOME SPOTS THAT LOOK LIKE DIORITE AND OTHERS THAT LOOK LIKE ANDESITE, COULD BE DUE TO CLASTS. SOME PHENOS OF HORNBLENDE AND POSSIBLY PLAG SEEN, ALTERATION AND BROKEN UP ROCK OBSCURING MOST FEATURES."
AXE-23-002,,,,,,,,,,
AXE-23-002,,,,,,,,,,
AXE-23-002,86.95,104.0,DIO,DIO,INT,FMG,XEN,POR,,"MED-DARK GREEN TO GREY DIORITE. THIS UNIT STARTS OUT FAIRLY SKARN ALTERED SO THE TEXTURE IS HARD TO DISTINGUISH, BUT A FINE-MED GRAINED GROUNDMASS IS VISIBLE WITH WHAT LOOKS LIKE PHENOS. SOME PLAG AND HORNBLENDE PHENOS UP TO ~2MM OBSERVED. SOME OF THIS UNIT HAS FAULTING AND SHEARING WHICH MAKES THE TEXTURE HARDER TO DISTINGUISH AND SOME LOOKS TO BE DEFORMED BY SHEARING. SOME OF WHAT LOOKS LIKE CLASTS NEAR FAULTED ZONES BUT EP/SKARN/PHYLLIC ALTERATION IS MAKING THEM DIFFICULT TO DISTINGUISH."
AXE-23-002,,,,,,,,,,
AXE-23-002,,,,,,,,,,
AXE-23-002,,,,,,,,,,
AXE-23-002,,,,,,,,,,
AXE-23-002,,,,,,,,,,
AXE-23-002,104.0,105.0,CL,CL,NC,,,,,CORE WAS LOST DUE TO DRILLERS NEEDING TO TRICONE THROUGH AND ADVANCE CASING TO 105M
AXE-23-002,105.0,134.0,DIO,DIO,INT,FMG,XEN,POR,,"MED-DARK GREEN TO GREY DIORITE. SAME TYPE OF DIORITE AS ABOVE THE LOST CORE INTERVAL. SOME OF THIS UNIT HAS FAULTING AND SHEARING WHICH MAKES THE TEXTURE HARDER TO DISTINGUISH AND SOME LOOKS TO BE DEFORMED BY SHEARING. SOME OF WHAT LOOKS LIKE CLASTS NEAR FAULTED ZONES BUT EP/SKARN/PHYLLIC ALTERATION IS MAKING THEM DIFFICULT TO DISTINGUISH. THE BOTTOM OF THIS UNIT IS QUITE ARGILLICALLY ALTERED SO TEXTURES ARE HARD TO DISTINGUISH, WITH THE CORE LOSS AT THE BOTTOM THIS MAY BE DUE TO A STRONG FAULT THAT WASN'T RECOVERED AND IS PROBABLY THE END TO UNIT AS SOME OF THE INTACT ROCK STILL SLIGHTLY LOOKS LIKE DIORITE."
AXE-23-002,,,,,,,,,,
AXE-23-002,,,,,,,,,,
AXE-23-002,134.0,135.45,CL,CL,NC,,,,,"DRILLER ENCOUNTERED PROBLEMS WITH DRILLING AND HAD TO TRICONE THROUGH THIS SECTION, NO CORE RECOVERED."
AXE-23-002,135.45,178.4,VCL,VCL,VCB,FMG,XEN,POR,,MED-DARK GEY-GREEN VOLCANOCLASTIC OR BRECCIATED ANDESITE. TOP CONTACT IS UNCLEAR AS THERE IS STRONG ARGILLIC ALT BEFORE CORE LOSS BUT AFTER 135.45 THERE ARE OBVIOUS CLASTS SEEN. MATRIX IS FINE-MED GRAINED WITH MOSTLY SUB-ANGULAR CLASTS COMPOSED OF POSSIBLE DIORITE AND ANDESITE. CLASTS RANGE FROM LESS THAN A CM TO MANY CMS. SLIGHTLY MAGNETIC IN SPOTS.
AXE-23-002,178.4,194.55,MM,MM,VCB,VFG,CHL,APHAN,,"SKARN STARTS GRADUALLY WITH VARYING AMOUNTS OF MAGNETITE+PYRITE+EPIDOTE+CHALCOPYRITE+GARNET+ACTINOLITE. WHERE THE ALTERATION INSTENSITY IS LOW, PROTOLITH IS STILL THE SAME VOLCANIC BRECCIA. STRONGEST SKARN SECTION IS BETWEEN 185.5-194.5 M CHARACTERIZED WITH VERY FINE GRAINED MAGNETITE+PYRITE+EPIDOTE. SERICITE OVERPRINT THAT GRADES INTO CLAY ALTERATION IN SOME INTERVALS. POSSIBLE CAVE-IN MATERIAL BETWEEN 182-185.42 M. DOMINANT VEINING IS MAGNETITE+PY+CHALCOPYRITE CRACKLES AND VEINS. MINOR PY+EP+CP VEINS. PYRITE AND CHALCOPYRITE IS MOST LIKELY SECONDARY, REPLACING MAGNETITE SKARN AND MAGNETITE VEINS. LATE CALCITE VEINING."
AXE-23-002,,,,,,,,,,
AXE-23-002,194.55,206.86,VCL,VCL,FLT,VFG,,,,"SECTION STARTS WITH A 10 CM CALCITE VEIN WITH MINOR CPY+PY. THIS IS A FAULTED SECTION WITH INTENSE RUBBLE, FAULT GOUGE, AND CLAY ALTERED SECTION. ORIGINAL ROCK TEXTURE IS COMPLETELY ENHANCED AND THE PHOTOLITH IS ASSUMED TO BE CONTINUATION OF UPHOLE VOLCANIC BRECCIA UNIT. ORIGINAL EPIDOTE ALTERATION OVERPRINTED BY STRONG RETROGRADE CLAY ALTERATION. NO MAGNETITE (POSSIBLY DESTROYED AS A RESULT OF ALTERATION), AND MOST OF THE SULPHIDE MINERALIZATION IS LOST TO THE CLAY ALTERATION. ~0.5 CPY"
AXE-23-002,206.86,217.5,MM,MM,VCB,VFG,APHAN,STR,,"MAGNETITE+EPIDOTE SKARN AFTER THE FAULT. COMPARED TO THE OTHER SKARN LEVEL, THIS SKARN IS CHARACTERIZED WITH MAGNETITE AND EPIDOTE WITH LESS SULPHIDES. VERY FINE GRAINED MAGNETITE AND EPIDOTE BANDS. POSSIBLY THIS SECTION IS NOT OVERPRINTED BY A SULPHIDE RICH FLUID. CLAY OVERPRINT. VERY LOW RECOVERY BUT LESS RUBBLE."
AXE-23-002,217.5,251.42,VCL,VCL,VCB,,APHAN,XEN,CHL,"POLYMICTIC CONGLOMERATE WITH TUFF LAND PORPHYRY ANDESITE EVELS.WEAK TO MODERATE PROPYLITIC ALT DOMINATED WITH EP, MINOR CHL AND ACT. PROPYLITIC ALT IS MOSTLY CONFINED IN XENOLITHS OR PROPYLITIC VEINS. PROPYLITIC IS OVERPRINTED BY SERICITE AND SILICIFICATION. CLAY ALTERATION IS DOMINANT BETWEEN 217.5-230 M AND 241-251.42 M. GROUNDMASS AND XENNOLITHS HAVE A VERY DULL, GLASSY LOOK DUE TO THE SILICIFICATION. DOMINANT VEINING IS LATE CALCITE AND TYPE 2 PROPYLITIC+/-CALCITE VEINS. THESE VEINS USUALLY CONTAIN CLAY MINERALS AND LEACHED OUT WITH THE CLAY ALTERATION. GENERALLY, POOR IN SULPHIDES EXCEPT A FEW INTERVALS WITH CCP AND PY DUSTING (217.5-233 M). CRUSHED SECTION BETWEEN 241-251.42 M. SECTION ENDS WITH A CHILLED MARGIN (STRONG EPIDOTE+CLAY ALTERATION) RELATED TO THE DYKE CONTACT AT 251.42 M."
AXE-23-002,,,,,,,,,,
AXE-23-002,,,,,,,,,,
AXE-23-002,,,,,,,,,,
