hole_number,from_m,to_m,base_lithology,litho_detailed,lith_general,lith_grain_size,lith_texture1,lith_texture2,lith_texture3,lith_description
AXE-23-007,235.18,237.54,MM,MM,,FG,,,,"GREEN MOTTLED TEXTURE, MOD MAGNETIC SKARN ALT RK 0.5% PATCHES OF PY AND STR 0.1% CCP PATCHES HEMATITE ON FRACT NOTED"
AXE-23-007,237.54,240.0,MM,MM,,FG,,,,"FG, DARK MAGNETITE SKARN. EPI-ACT-CHL-PY+-CCP NOTED WITHIN THE INTERVAL."
AXE-23-007,240.0,259.3,VCL,VCL,,MCG,,,,"PALE GREEN, POLYMICTIC CLASTS, PHYLLIC (SER-CHL-SIL-CARB) ALT, VOLCANICLASTICS. CLASTS COMPOSED OF SUBROUNDED TO ANGULAR WITH SIZES RANGES FROM ~1MM TO 1CM. OBSEVED TO BE CROWDED. ELONGATED, DARK MINERALS ALTERED GENERALLY TO CHLORITE, AND SOME LIGHT CLASTS POSSIBLY PLAG ARE ALTERED TO KSPAR AND SERECITE. SERECITE ON FRACTURES ALSO NOTED, WEAK HEMATITE ON SOME PARTS MINOR MAG ALT ON SOME PARTS NOTED."
AXE-23-007,259.3,261.7,MM,MM,,FG,,,,"GREEN MOTTLED TEXTURE, MOD MAGNETIC SKARN ALT RK 5% PATCHES OF PY AND STR 0.5% CCP PATCHES HEMATITE ON FRACT NOTED"
AXE-23-007,261.7,268.2,VCL,VCL,,CG,SER,XEN,,"PALE GREEN, POLYMICTIC CLASTS, PHYLLIC (SER-CHL-SIL-CARB) ALT, VOLCANICLASTICS. CLASTS ARE CROWDED LOOKING, RANGES FROM <1CM TO 8CM. DARK CLASTS ARE ALTERED TO CHL-EPI WHILE THE LIGHTER CLASTS ARE ALTERED TO CLAY, AND SERECITE. CAL VEINLETS NOTED ON SOME PARTS, AND ON FRAC FILLS. NON MAGNETIC"
AXE-23-007,268.2,270.2,MM,MM,,,,,,"GREEN MOTTLED TEXTURE, MOD MAGNETIC SKARN ALT RK ALT ASSEMBLAGES (EPI>CHL>SER>MAG>GARNET) 5% PATCHES OF FG PY+CCP+MAG BLEBS OF GARNET PRESENT AT ~269.4M."
AXE-23-007,270.2,274.66,VCL,VCL,,MCG,,,,"PALE GREEN, POLYMICTIC CLASTS, PHYLLIC (SER-CHL-SIL-CARB) ALT, VOLCANICLASTICS. CLASTS ARE CROWDED LOOKING, RANGES FROM <1CM TO 8CM. DARK CLASTS ARE ALTERED TO CHL-EPI WHILE THE LIGHTER CLASTS ARE ALTERED TO CLAY, AND SERECITE."
AXE-23-007,,,,,,,,,,
AXE-23-007,274.66,288.12,VCL,VCL,SVI,MCG,XEN,,,"GREEN TO GREY, MOD PROP (CHL>EPI>CARB) WITH WEAK PHYLLIC (SER>PY>SIL) ALT, VOLCANICLASTIC. SUBHEDRAL TO EUHEDRAL CLASTS OBSERVED WITHIN THE INTERVAL. WHT ELONGATED PHENOS POSSIBLY PLAG WITH SIZE RANGING FROM >1CM TO 3CM, NOTED ON SOME PARTS. DARK MINERALS OBSERVED TO BE ALTERED TO CHLORITE AND MAGNETITE. MAGNETITE CLAST ALSO NOTED AT ~283.4M SIZE RANGE OF 3.5CM. VUGGY CALCITE VEIN FROM 277.10M TO 278.88M, NOTED TO HAVE BEEN REPLACED BY EPI>MAG>PY>CCP>GARNET? A ~0.10M BRECCIATED, WITH MAG-PY+CCP-GARNET AND A PINK MOD SOFT CARBONATE MINERAL, POSSIBLY RHODOCHROSITE? OBSERVED AT 280.59M."
AXE-23-007,288.12,291.39,MAD,MAD,DYK,FG,,,,"GREY, FG MAFIC DYKE, WEAKLY PROP ALT"
AXE-23-007,291.39,302.59,VCL,VCL,SVI,CG,,,,"GREEN TO GREY, MOD PROP (CHL>EPI>CARB) WITH WEAK PHYLLIC (SER>PY>SIL) ALT, VOLCANICLASTIC. SUBHEDRAL TO EUHEDRAL CLASTS OBSERVED WITHIN THE INTERVAL. SAME AS THE OTHER VLCL"
AXE-23-007,,,,,,,,,,
AXE-23-007,,,,,,,,,,
AXE-23-007,,,,,,,,,,
AXE-23-007,302.59,304.68,VCL,VCL,FLT,CG,,,,"GREEN TO GREY, MOD PROP (CHL>EPI>CARB) WITH WEAK PHYLLIC (SER>PY>SIL) ALT, VOLCANICLASTIC. SUBHEDRAL TO EUHEDRAL CLASTS OBSERVED WITHIN THE INTERVAL. FAULTED"
AXE-23-007,304.68,311.19,VCL,VCL,SVI,MCG,XEN,,,"GREEN TO GREY, MOD PROP (CHL>EPI>CARB) WITH WEAK SIL VOLCANICLATSIC CROWDED, 1MM TO 1CM CLAST SIZES, SUBHEDRAL. DARK MIN ALTERED TO CHL, WEAKLY MAG ON SOME PARTS, PHENO SELECTIVE KSPARS - NOT DETERMINED WHETHER AN ALTERATION OR CLASTS."
AXE-23-007,311.19,446.69,VCL,VCL,SVI,MCG,XEN,,,"VOLCANICLASTIC CONGLOMERATE GREEN-GREY MEDIUM GRAINED POLYMICTIC VOLCANICLASTIC CONGLOMERATE. CLASTS VARY IN SIZE (0.2 - 2CM), ANGULARITY (ANGULAR TO SUBROUNDED/ROUNDED) AND VARYING ALTERATION ASSEMBLAGES. CLASTS ARE DOMINATED BY 4 LITHOLOGIES CONSISTING OF STRONGLY ALTERED EPIDOTE-SERICITE ANDESITES, APHANITIC MAFIC-ANDESITE/BASALT +/- MAGNETITE, UNDIFFERENTIATED RHYOLITE/INTRUSIVE WITH PLAGIOCLASE PHENOCRYSTS AND STRONG HEMATITE STAINING, +/- SILICIFICATION AND +/- POTASSIC ALTERATION AND STRONGLY ALTERED VUGGY LIMESTONE CLASTS REPLACED BY PY-CP +/- MAGNETITE/ACTINOLITE. THE GREEN-GREY GROUNDMASS CONSISTS OF MOSTLY CHLORITE-SERICITE AND PERVASIVE SECTIONS OF EPIDOTE. LIMESTONE CLASTS ARE OBSERVED WITHIN THE CONGLOMERATE CLAST ASSEMBLAGE, LIKELY APART OF THE HARMON FORMATION (240-214 MA)."
AXE-23-007,,,,,,,,,,
AXE-23-007,,,,,,,,,,
AXE-23-007,,,,,,,,,,
AXE-23-007,,,,,,,,,,
AXE-23-007,,,,,,,,,,
AXE-23-007,446.69,451.51,VCL,VCL,,FMG,STR,,,"GREEN TO GREY, PROP ALT, VOLCANICLASTIC. NOTED FINE GRAINED SANDSTONE FROM ~450.66M TO 451.51M. 0.5% PATCHES OF FG PY NOTED WITH EPIDOTE ALT CALCITE AS FRACTURE FILLS NOTED."
AXE-23-007,451.51,459.0,VCL,VCL,VCB,MCG,,,,"GREEN TO GRY, MED TO COARSE GRAINED VOLCANICLASTIC ANDESITE. POLYMICTIC CLASTS, RANGES FROM 1MM TO 4CM. CLASTS ARE ALTERED TO CHL-HEM AND GROUNDMASS IS WEAKLY MAGNETIC ~18CM OF WHT-GRY MASSIVE QTZ VEIN? WITH MAG-HEM-PY+-CCP NOTED FROM 451.51M. MAGNETITE-HEM(SPECULAR) SEEMS TO REPLACE ACTINOLITE, RETAINING ITS BLADED STRUCTURE. POSSIBLY SKARN? ENDED THE HOLE DUE TO LOW MINERALIZATION NOTED. EOH."
AXE-23-008,0.0,19.0,OVB,OVB,NC,,,,,"NO CORE RECOVERED, HIT BEDROCK"
AXE-23-008,19.0,21.0,CL,CL,NC,,,,,BEDROCK. CASING TO 21M. NO CORE RECOVERED
AXE-23-008,21.0,47.88,DIO,DIO,INT,MG,,,,"GREY TO GREEN, MEDIUM GRAINED, WEAKLY PROP ALT DIORITE. MOD OXIDIZED FROM 21M-27.9M, WITH WEAK OXIDATION ON FRACTURES UNTIL 36M. ~1MM PHENO SIZES, GENERALLY CONSISTENT ALL THROUGHOUT THE INTERVAL. DARK MINERALS (HBL+-BIO) ALTERED MAINLY TO CHL. LIGHT MINERALS WEAKLY ALTERED TO A SOFTER CLAY? MINERAL CHL ALT WITH MINOR EPI+CARB ON FRACTURES PATCHES OF PYRITE NOTED NEAR VEINS/FRACTURES, PY STRINGERS NOTED AS WELL. FG OX PY+-CCP OBSERVED. WEAKLY MAGNETIC ON SOME PARTS FROM 21M TO 27M, OBSERVED UNFILLED/WEATHERED VEINLETS/STRINGERS. WHT MASSIVE CALCITE VLT/STR NOTED."
AXE-23-008,47.88,49.3,AND,AND,DYK,FG,POR,,,"GREY TO GREEN, PORPHYRITIC MAFIC DYKE (ANDESITE?) ~1-2MM DARK PHENOS POSSIBLY HBL WEAKLY ALTERED TO HEMATITE, FINE GRAINED GROUNDMASS TOO SMALL TO IDENTIFY. ~1-2MM MINOR (AS DARK PHENOS ARE MORE PROMINENT) WHITE PHENOS, POSSIBLY PLAG OBSERVED TO BE ALTERED TO CALCITE. ALTERATION ASSEMBLAGE (CHL>CARB>HEM) WHT MASSIVE CAL VN/VLT OBSERVED."
AXE-23-008,49.3,53.7,DIO,DIO,INT,FG,,,,"LIGHT GREY TO LIGHT GREEN, FG-MG, WEAKLY PROP TO PHYLLIC ALT DIORITE. ALTERATION ASSEMBLAGE (SER-CHL-CLAY-PY+-SIL) ~1MM PHENOS COMPOSED OF DARK MINERALS OBSERVED TO BE ALTERED TO CHLORITE, WHILE WHITE MINERALS SOME ARE ALT TO CLAY. FG MASSIVE PY FLOODING OBSERVED THROUGHOUT THE INTERVAL. 1% OF FINE GRAINED MASSIVE PY+DARK SUL VNLT/STR, MORE PROMINENT FROM ~52.13M TO 53.7M. GREENISH, CHLORITE? CLAST-LIKE IN SHAPE, NOTED TO BE MINERALIZED BY CLUSTER OF PYRITE NOTED WITHIN THE INTERVAL. ~3MM TO 10MM WHT-GREY MASSIVE QTZ-CAL VN NOTED FROM 49.35M. POSSIBLY EARLY VEINS SINCE WHT MAS-CAL VIEN NOTED TO BE CUTTING THROUGH QTZ-CAL VEIN WHT- VUGGY CALCITE VEINLETS OBSERVED."
AXE-23-008,53.7,60.29,DIO,DIO,INT,MG,,,,"GREEN TO GREY, MEDIUM GRAINED, DIORITE WEAK TO MOD PROP ALT (CHL>EPI>CARB) WK MAG REPLACEMENT ON SOME PARTS EPIDOTE AND CAL STRINGERS NOTED TRACE PY DISS"
AXE-23-008,60.29,62.67,DIO,DIO,INT,FMG,,,,"LIGHT GREY TO GREEN, FG-MG, PROP ALT DIORITE, WEAKLY BLEACHED. ALT ASSEMBLAGE (CHL>EPI>CARB+-SIL) EPIDOTE ON FRACTURES NOTED ALONG THE INTERVAL. FG TO MG MASSIVE PY DISS AND ON FRACTURES OBSERVED. BLEBS OF CCP NOTED ON SOME PARTS."
AXE-23-008,62.67,65.78,DIO,DIO,INT,FG,,,,"PALE GREY TO GREENISH, FG, WEAKLY ARGILLIC ALT DIO ALT ASSEMBLAGE CHL>SER>PY>EP+-SIL INTERVAL HIGHLY FRACTURED,POSSIBLY FAULTED. MASSIVE FG TO MG PYRITE OBSERVED ON FRACTURES AND AS REPLACEMENT. NOTED THE INTERVAL THAT SOME SPOTS LOOKS VUGGY. EPIDOTE SEEMS TO BE REPLACING SOME VUGS AS WELL MINOR GOUGE OBSERVED"
AXE-23-008,65.78,69.0,DIO,DIO,INT,MG,,,,"GREY TO GREEN, MED GRAINED, PROP ALT DIO ALT ASSEMBLAGE (CHL>EPI>CARB) NOTED A SMALL ~1CM FG CLAST (XENO?) NOTED FROM ~68.5M -NON MINERALIZED PERVASIVE CHL ALT ON DARK PHENOS AND GROUNDMASS, WHILE EPI NOTED TO BE MORE AS FRAC FILLS AND AS PATCHES. MINOR CAL ALT ON GROUNDMASS AND SA FRAC FILLS INTERVAL LOOKS SHEARED, FAULTED, WITH MINOR GOUGE ON FRACTURES. FG PY DISS ON, WITH CLUSTERS OF PYRITE ON SOME PARTS. WHT MASSIVE CALCITE VEINS NOTED FROM ~66.1M,"
AXE-23-008,,,,,,,,,,
AXE-23-008,69.0,75.0,DIO,DIO,INT,MG,,,,"GREY TO GREEN, MED GRAINED, PROP ALT DIO ALT ASSEMBLAGE (CHL>EPI+-CARB) INTERVAL LOOKS VUGGY SINCE THE FILLING FOR VEINS IS GONE, POSSIBLY INDICATING AN EARLY VEIN THAT HAS BEEN DISPLACED BY MULTIPHASE ACTIVITY. THESE ""VUGS"" HAS NOW BEEN REPLACED BY EPIDOTE+-PY. PATCHES OF CCP NOTED ON SOME PARTS RELATED TO EPI. WHT MAS CAL VEINLETS OBSERVED"
AXE-23-008,75.0,96.41,DIO,DIO,INT,MG,,,,"GREEN TO GREY, MOD PROP ALT, DIO ALT ASSEMBLAGE (CHL>EPI>CARB+-SER) STRONGER EPI ALT IN THIS INTERVAL COMPARED TO THE ONE ABOVE EPI APPEARS TO BE IN FRACTURES AND AS PATCHES. CHL ALT IS STILL PERVASIVE ON DARK MINERALS. SUBHEDRAL, INTERLOCKING DARK(HBL?) AND WHITE (PLAG?) MIN OBSERVED THAT RANGES FROM ~<1MM TO 1MM IN SIZE. WK TO MOD MAGNETITE REPLACEMENT ON SOME DARK MIN NOTED AS WELL FROM ~82.3M WHT MASSIVE CAL VL WITH EPI-SER HALO ALSO OBSERVED WITHIN THIS INTERVL, WITH CLUSTER OF FG PY+CCP, 1% FG PY DISS WHT MASSIVE CAL WITHOUT THE HALO IS ALSO OBSERVED."
AXE-23-008,96.41,98.55,DIO,DIO,INT,FMG,,,,"PALE GREEN TO WHITE, WEAKLY TO MOD PHYLLIC ALT DIO ALT ASSEMBLAGE (CLAY>SER>CHL>SIL+-HEM,MAG) TEXTURE AND PHENOS ARE HARD TO DECIPHER SINCE THE ALTERATION IS QUITE PERVASIVE AND DESTRUCTIVE. SOME PARTS SHOW THAT LIGHT MINERALS POSSIBLY PLAG ARE ALTERED TO CLAY, SERECITE AND HEMATITE, THE DARK PHENOS ARE ALTERED TO CHL, MINOR MAG. FG PATCHES OF PY+-CCP OBSERVED TO BE GENERALLY ON CHLORITE ALT PHENOS, OR ON FRACTURES."
AXE-23-008,,,,,,,,,,
AXE-23-008,98.55,103.47,DIO,DIO,INT,FMG,,,,"GREY TO GREEN, PROP ALT DIORITE. ALT ASSEMBLAGE (CHL>EPI>+-MAG, MINOR SALMON PINK, KSPAR? ALT ON FRACTURES) MINOR PY+CCP ON THE EDGES OF EPIDOTE+KSPAR ALTERATION. INTERVAL IS MODERATELY BROKEN."
AXE-23-008,103.47,104.25,HBX,HBX,BX,MG,,,,"GREEN TO ORANGE-PINK, CLAST SUPPORTED SUPPORTED HBX? CLASTS COMPOSED OF ORANGE-PINK KSPAR SET ON A FINE GRAINED DIO? MATRIX WITH MASSIVE QTZ-CAL-PY+CCP VN. CLAST TO MATRIX RATIO OF 70:30."
AXE-23-008,104.25,120.0,DIO,DIO,INT,FMG,,,,"GREEN TO GREY, FG TO MG, MOD PROP DIORITE? PHENOS OBSERVED TO HAVE BEEN ALTERED TO CHL, SOME LIGHT MINERALS NOTED TO BE POSSIBLY PLAG INTERVAL IS MOD TO STRONGLY BROKEN. MAKING IT DIFFICULT TO OBSERVED FOR VEINING. WEAKLY MAGNETIC ON SOME PARTS. SALMON PINK TO ORANGE ALTERATION NOTED AS PATCHES AND/OR FRAC FILLS. THIS IS POSSIBLY KSPAR. PATCHES OF FG TO MG PY DISSEMINATES AND AS FILLS OBSERVED. LOW RECOVERY"
AXE-23-008,120.0,144.0,DIO,DIO,INT,FMG,,,,"GREEN TO GREY, FG, PROP ALT DIORITE? ALT ASSEMBLAGE (CHL>CARB>EPI>MAG+PY) OBSERVED A 4CM WHT MASSIVE CALCITE VEIN WITH PY+FG DARK SUL ON FRACTURES FROM ~122.56M. 5% MASSIVE PYRITE DISS AND ON FRACTURES, SOME PYRITE ARE MED GRAINED AS WELL. INTERVAL IS STRONGLY BROKEN. NOTED FROM 127.3 TO 128.10, GREY TO WHITE, FG, ARGILLIC ALTERED ROCK GOUGE WITH FG PY DISS."
AXE-23-008,,,,,,,,,,
AXE-23-008,,,,,,,,,,
AXE-23-008,144.0,150.27,DIO,DIO,INT,,PSBX,,,"GREEN TO GREY, MOTTLED TEXTURE DUE TO MOD SKARN ALTERATION, PROTOLITH DIO? ALT SKARN ASSEMBLAGE (EPI>CHL>>CARB>MAG+-GARNET) THE INTERVAL IS MODERATELY BROKEN, SOME PARTS OBSERVED TO HAVE THE BROWN, FINE GRAINED GARNET? ASSOC WITH FRACTURES. ALSO OBSERVED BROWN, SANDY POSSIBLY GARNET FROM ~147M. NOTED A ~3CM GREY, MOD HARD (~5) CLAST MINERALIZED WITH PY ON FRAC MASSIVE PYRITE DISSEMINATES ALL THROUGHOUT THE INTERVAL."
AXE-23-008,150.27,162.51,FBX,FBX,FLT,FG,,,,"PALE GREEN TO PALE GRAY, FG, MOD PHYLLIC ALT HEALED FAULT BRECCIA (MAGMATIC)?. PROTOLITH HARD TO DISTINGUISH DUE TO ALT AND STRUCTURE. ROCK OBSERVED TO HAVE MONOMICTIC CLASTS (SUBANGULAR), MATRIX SUPPORTED. CLAST TO MATRIX RATIO OF 20:80. ALT ASSEMBLAGE (SER>CHL>CLAY+-SIL,PY). INTERVAL IS BROKEN, WITH SHEARED ZONE ~40TCA OBSERVED FROM 160M TO 162M WITH 2CM WHT MASSIVE TO VUGGY, CALCITE-GYPSUM? VEIN. EPI-ACT-PY+-CCP STRINGERS NOTED WITHIN THIS ZONE. 5% PATCHES AND DISS OF PY 2CM WHT MAS PY VN FROM 162.28 TO 162.51M."
AXE-23-008,162.51,168.8,VCL,VCL,FLT,FG,XEN,,,"PALE GREEN TO PALE GRAY, FG, PROP WEAKLY ARGILLIC ALT BRECCIA?. SOME PARTS OBSERVED TO HAVE A DIORITIC MATRIX POSSIBLY PROTOLITH. ROCK OBSERVED TO HAVE MONOMICTIC CLASTS (SUBANGULAR) RANGES FROM 1MM TO 1CM, MATRIX SUPPORTED. CLAST TO MATRIX RATIO OF 10:90. NOTED SOME GOUGE AS WELL. ALT ASSEMBLAGE CHL>CLAY>SER>PY MASSIVE PY ON FRACTURES, ACT/CHL STRINGERS AND CAL STRINGERS NOTED"
AXE-23-008,168.8,177.1,VCL,VCL,VCB,FMG,,,,"GREEN TO GREY, FG TO MG, PROP ALT BRECCIA (MAGMATIC?) POLYMICTIC CLASTS, MATRIX SUPPORTED. MATRIX IS FINE GRAINED OF LIGHT (PLAG) AND DARK MINERALS. CLASTS ARE NOT MINERALIZED, PY ON MATRIX LARGER (SUBANGULAR) CLASTS NOTED ~2MM TO 1CM IN SIZE, PINK KSPAR? AND DARK MINERAL ALTERED TO MAGNETITE. ALT ASSEMBLAGE CHL>EPI>CARB+-HEM WITH SKARN (EPI>ACT>GARNET>MAG) ALT FROM 176.53M. GARNET OBSERVED HERE TO BE BROWN IN COLOR, CUT BY EPIDOTE WITH FG CCP+PY ON CENTER. 5% FG PY+CCP DISS AND ON FRACTURES"
AXE-23-008,177.1,184.66,MM,MM,,VFG,APHAN,,,"DARK,FINE GRAINED, MASSIVE MAGNETITE CROSS CUTTED BY EPI WITH PY+CCP. MAGNETITE+CARB+HEM ALT FG CCP+PY OBSERVED TO BE GENERALLY ON THE FRACTURES AND AS STRINGERS/VEINLETS. GARNET+EPI+ACT ALT AND LATE WHT MAS CAL STRINGERS CAN BE OBSERVED FROM ~182M TO END OF THIS INTERVAL. MINOR HEMA STAINS NOTED ON SOME PARTS"
AXE-23-008,184.66,194.23,VCL,VCL,VCB,FMG,,,,"GREEN TO GREY, MEDIUM GRAINED WITH OCCASIONAL LARGER CLASTS PROP ALT, VOLCANICLASTICS?. MATRIX SUPPORTED WITH OCCASIONAL LARGER SIZED CLASTS. CLASTS OBSERVED FROM ~1MM TO ~3CM IN SIZE, ANDESITIC IN COMPOSITION. ALT ASSEMBLAGE OF CHL>EPI>CARB>PY EPI+PY+CCP VEINLETS NOTED TO BE CUTTING THROUGH THE LARGER CLASTS FROM ~186.15M AND THIS IS ALSO OBSERVED THROUGHOUT THE INTERVAL. WHT MASSIVE CAL VEINLETS OBSERVED TO HAVE BEEN REPLACED BY LATE PY+CCP+EPI+HEM NOTED FROM 190.7M. EPIDOTE SEEMS TO BE GENERALLY PRESENT WITH PY+CCP ALL THROUGHOUT THE INTERVAL. MINOR SKARN (EPI>ACT>GARNET) ALT CAN BE OBSERVED ON CONTACT BETWEEN THE VLCL AND MASSIVE MAGNETITE FROM 184.66 TO 185.5M. INTERVAL IS MODERATELY BROKEN. LATE BARREN WHT MASSIVE CALCITE AS FRACTURE FILLS NOTED AS WELL."
AXE-23-008,194.23,204.8,VCL,VCL,VCB,FMG,,,,"PALE GREEN MED GRAINED, PROP ALT OVERPRINTED BY ARGILLIC ALT, VOLCANICLASTICS? MATRIX SUPPORTED, POORLY SORTED, WITH CLASTS RANGING FROM ~1MM TO 1CM IN SIZE. ALT ASSEMBLAGE CHL>CARB OVERPRINTED BY CLAY, SLIGHTLY BLEACHED PATCHES OF FG PY DISSEMINATES, MORE PROMINENT ON SPOTS WHERE ARGILLIC ALT IS WEAKER. BLEBS OF CCP NOTED."
AXE-23-008,204.8,210.55,MM,MM,,VFG,APHAN,,,"DARK,FINE GRAINED, MASSIVE MAGNETITE CROSS CUTTED BY EPI WITH PY+CCP. MAGNETITE+CARB+HEM ALT. INTERVAL IS SOFT, AND FRIABLE COMPARED TO THE FIRST MM ENCOUNTERED. FG CCP+PY OBSERVED WITHIN THE INTERVAL. THE SKARN ALT ASSEMBLAGE NOTED FROM 177.1 TO 184.66M IS NOT OBSERVED IN THIS INTERVAL."
AXE-23-008,210.55,240.0,VCL,VCL,VCB,FMG,,,,"GREEN TO GREY, FG TO MG, PROP ALT VOLCANICLASTICS. MODERATELY SORTED, MATRIX SUPPORTED, AND POLYMICTIC. SOME CLASTS OBSERVED TO HAVE BEEN ALTERED TO CHLORITE. SPARSE AND WEAK MAGNETITE REPLACEMENT. ALT ASSEMBLAGE CHL>EPI>CARB WITH WEAK PINKISH, KSPAR+-BIO ALT FROM ~218M TO 219M. 0.5% PY+-CCP DISS ON SOME PARTS"
AXE-23-008,240.0,279.5,VCL,VCL,VCB,MCG,,,,"MED TO LIGHT GREEN, PROP ALT VLCL (MAGMATIC BRECCIA?) POLYMICTIC, POORLY SORTED SUBROUNDED TO ROUNDED, MATRIX SUPPORTED. CLASTS VARIES IN SIZE FROM ~1MM TO 4CM. SOME LARGER CLASTS ARE DARK GREY-GREEN ALTERED TO MAGNETITE, SOME SMALLER LIGHT MINERALS OBSERVED TO BE CHL,EPI OR CLAY ALT. MATRIX VARIES FROM FG TO MEDIUM GRAINED. SOME LARGER CLASTS OBSERVED TO HAVE SOME ""GHOSTS"" PHENOS INCLUSIONS. FG PY STRINGERS ARE MORE DOMINANT THAN DISSEMINATIONS. CLUSTERS OF FG PY ALSO FOUND ON SOME EPI-CLAY ALTERED CLASTS, WHILE MOST OF THE DARK MAGNETIC CLASTS ARE UNMINERALIZED. ALT ASSEMBLAGE CHL>EPI>CARB WITH WEAK PHYLLIC (SER>SIL>PY) OVERPRINT ON SOME PARTS"
AXE-23-008,,,,,,,,,,
AXE-23-008,,,,,,,,,,
AXE-23-008,,,,,,,,,,
AXE-23-008,279.5,282.9,VCL,VCL,VCB,FMG,,,,"PALE GREEN TO GREEN, SCC ALTERED, VOLCANICLASTIC? OBSERVED FG TO MG CLAY ALTERED DIO? FROM 281.10M TO 281.58M. 5% FG PY DISS"
AXE-23-008,282.9,294.0,VCL,VCL,VCB,MCG,,,,"GREEN TO PALE GREEN, WK PROP TO MOD PHYLLIC ALT VLCL (MAGMATIC BRECCIA?) POLYMICTIC, POOR TO MOD SORTED, SUBROUNDED TO ROUNDED CLASTS, CLAST SUPPORTED. CLASTS COMPOSED OF MAGNETITE-CHL-EPI ALTERED CLASTS. SOME CLASTS ARE MINERALIZED WITH FG PY+-CCP. ALT ASSEMBLAGE CHL>EPI>SER>SIL>PY SERECITE MORE PROMINENT AS FRACTURE FILLS, WHILE EPIDOTE AND CHL ARE ON CLASTS. ~10% FG PY AS DISS/STRINGERS AND BLEBS."
AXE-23-008,294.0,297.0,VCL,VCL,VCB,MG,,,,"PALE GREEN TO GREEN, WEAKLY SCC ALT VLCL (MAG BXA?) PINK, MOD HARD, KSPAR (VEIN OR ALT?) NOTED FROM ~296M TO 296.44M 0.5% PY STR AND DISS NOTED. POLYMICTIC, MATRIX SUPPORTED, POORLY SORTED. MATRIX SEEMS TO BE MAGNETIC. CLASTS ARE ALTERED MAINLY TO EPIDOTE."
AXE-23-008,297.0,302.63,VCL,VCL,VCB,CG,,,,"GREEN, COARSE GRAINED, PROP ALT VLCL. MATRIX SUPPORTED, POLYMICTIC (2 CLASTS OBSERVED) WHT PLAG AND DARK MAGNETITE CLASTS SET ON A FINE GRAINED MATRIX EPIDOTE VEINING TO MOTTLED TEXTURE OBSERVED 5-10% FG TO MG PY AS FRAC FILLS BLEBS AND DISSEMINATES ALT ASSEMBLAGE CHL>EPI"
AXE-23-008,302.63,308.44,DIO,DIO,DYK,FG,,,,"GREY TO GREEN, PROP ALT MICRO DIORITE DYKE ALT ASSEMBLAGE CHL>CARB>HEM TRACE PY SPECKS HEM AND CHL ALTERING PREVIOUS AUGITE-HBL PHENOS SET ON A FINE GRAINED MATRIX"
AXE-23-008,308.44,311.58,VCL,VCL,BX,MG,,,,"PALE GREY TO PALE GREEN, SILICIFIED TO WEAKLY PROP ALT VLCL (MAG BXA?) AT THE START OF THE INTERVAL, THERES A FINE GRAINED MICRODIO DYKELET SAME FROM THE PREVIOUS LITH. THE INTERVAL IS OBSERVED TO BE SILICIFIED, WITH QTZ+-KSPAR STOCKWORKS/BRECCIATING WITH GYPSUM AT THE EDGES (INDICATING SECONDARY AFTER QTZ) AND MINIMAL TO NONE PY MINERALIZATION. POLYMICTIC, SUBANGULAR CLASTS, MATRIX SUPPORTED. 10% WHT MASSIVE GYPSUM VEINS NOTED ON THIS INTERVAL. CLUSTER OF 0.5% BLEBBY PYRITE+CCP NOTED AT THE START OF THE INTERVAL AND ~15CM OF DARK FG MAG+PY+CCP ""VEIN"" FROM 310.65M. ALT ASSEMBLAGE SIL>CHL>EPI"
AXE-23-008,311.58,313.01,DIO,DIO,DYK,FG,,,,"GREY TO GREEN, PROP ALT MICRO DIORITE DYKE ALT ASSEMBLAGE CHL>CARB>HEM TRACE PY SPECKS HEM AND CHL ALTERING PREVIOUS AUGITE-HBL PHENOS SET ON A FINE GRAINED MATRIX 0,1% OF WHT MASS GYPSUM VEINS NOTED"
AXE-23-008,313.01,315.33,HBX,HBX,BX,,,,,"GREEN TO GREY, ""CRACKLED"" HBX. CLAST SUPPORTED, MONOMICTIC COMPOSED OF WALLROCK (VLCL) SET ON A GYPSUM MATRIX. ALT ASSEMBLAGE CHL>EPI+-SIL 15% FG MASSIVE TO BLEBBY PYRITE DISSEMINATES/FLOODING WITH 0.1% CCP ON SOME PARTS ASSOC WITH EPIDOTE. 20% WHT MASS GYPSUM VEINLETS/STOCKWORKS. OBSERVED THAT GYPSUM VEINS ARE REPLACING SOME OF THE FRACTURES FILLED BY CALCITE OR BY PYRITE BEFORE, SOME PARTS STILL HAS WEAK CALCITE."
AXE-23-008,315.33,317.39,DIO,DIO,DYK,FG,,,,"GREY TO GREEN, PROP ALT MICRO DIORITE DYKE ALT ASSEMBLAGE CHL>CARB>HEM TRACE PY SPECKS HEM AND CHL ALTERING PREVIOUS AUGITE-HBL PHENOS SET ON A FINE GRAINED MATRIX 0,1% OF WHT MASS GYPSUM VEINS NOTED"
AXE-23-008,317.39,319.86,VCL,VCL,VCB,,,,,"GREEN TO GREY, VOLCANICLASTIC BRECCIA (HBX?) MONOMICTIC, MATRIX SUPPORTED. CLASTS OBSERVED TO BE QTZ+-KSPAR?. GYPSUM STOCKWORKS/VEINS NOTED TO HAVE DOMINATED THE INTERVAL. CLUSTERS OF PYRITE ALSO OBSERVED."
AXE-23-008,,,,,,,,,,
AXE-23-008,319.86,321.62,VCL,VCL,VCB,MCG,,,,"GREEN TO GREY, PROP ALT, POLYMICTIC VLCL. CLAST SUPPORTED, POORLY SORTED, SUBANGULAR TO SUBROUNDED SHAPE. SIZE RANGE FROM 1MM TO 1CM. INTERVAL GRADING TO FINER GRAINED, WITH PATCHES OF MAG REPLACEMENT. ALT ASSEMBLAGE (CHL>EPI) 5% WHT MAS GYP VNS 20% CLUSTER OF BLEBBY PY"
AXE-23-008,321.62,322.69,HBX,HBX,BX,,,,,"GREEN TO GREY, ""CRACKLED"" HBX. CLAST SUPPORTED, MONOMICTIC COMPOSED OF WALLROCK (VLCL) SET ON A GYPSUM MATRIX. ALT ASSEMBLAGE CHL>EPI+-SIL 15% FG MASSIVE TO BLEBBY PYRITE DISSEMINATES/FLOODING WITH 0.1% CCP ON SOME PARTS ASSOC WITH EPIDOTE. 20% WHT MASS GYPSUM VEINLETS/STOCKWORKS."
AXE-23-008,322.69,327.0,DIO,DIO,VCB,MG,,,,"GREEN TO GREY, FG TO MG DIORITE? PHENOS SIZE RANGE <1MM TO 1MM. PROP ALT (CHL>EPI, WEAKLY SIL) 0.21M OF DARK FG, MAGNETITE+PY+CCP NOTED FROM 323.65M @54TCA (CCP+PY GENERALLY ON MARGINS) 0.26M OF MG PROP ALT DYKE NOTED FROM 323.37M, OBSERVED TO BE A LITTLE DIFFERENT FROM THE MAIN LITHOLOGY FOR THIS INTERVAL. EPIDOTE MOTTLED TEXTURE. 5% WHT MASS GYPSUM VEINLETS/STOCKWORKS."
AXE-23-008,327.0,329.6,HBX,HBX,BX,,,,,"GREEN TO GREY, ""CRACKLED"" HBX. CLAST SUPPORTED, MONOMICTIC COMPOSED OF WALLROCK (VLCL) SET ON A GYPSUM MATRIX. ALT ASSEMBLAGE CHL>EPI+-SIL 15% WHT MAS GYPSUM VEINS/STOCKWORKS 10% BLEBS OF PY AND DISS"
AXE-23-008,329.6,339.0,VCL,VCL,VCB,,,,,"GREEN, GREY, COARSE GRAINED, POLYMICTIC VOLCANICLASTICS. ALT ASSEMBLAGE CHL>SIL>EPI+-MAG MATRIX SUPPORTED, POORLY SORTED, SET IN A ""ROCK FLOUR"" MATRIX. EPIDOTE OVERPRINTED OBSERVED. ""CRACKLED"" HBX OBSERVED FROM 336M TO 336.94M MONOMICTIC CLASTS FROM WALLROCK SET IN GYPSUM/AH VEINS. BLEBS OF PYRITE+CCP OBSERVED."
AXE-23-008,339.0,341.1,DIO,DIO,INT,MG,,,,"GREEN, MEDIUM GRAINED, PROPYLITIC ALT DIORITE ALT ASSEMBLAGE CHL>EPI>CARB PERVASIVE EPI ALT ON LIGHT MINERALS AND CHL ALT ON DARK MINERALS, CARB AS FRAC FILLS 5CM OF WHT MASSIVE QTZ STOCKWORKS/VEIN WITH 10% BLEBBY PYRITE FROM 339.13M. NOTED THAT THE GYPSUM IS WEAKLY REPLACING THE EDGES OF THE QTZ. 0.1% WHT MAS GYPSUM VEINS, 0.05% CAL STRINGERS, 0.1% GREEN, EPI VEINLETS/VN. NO PY MINERALIZATION WITHIN THE INTERVAL EXCEPT FOR THE ONE IN THE VEIN. NON MAGNETIC"
AXE-23-008,341.1,344.05,VCL,VCL,SVI,MCG,,,,"INTERCEPTED 0.37M OF GREEN TO GREY, PROP (CHL>EPI+MAG) ALT ANDESTIC VCL FROM 341.1, CONTACT? ~65TCA. FOLLOWED BY GREY, SILICA ALTERED, MONZODIORITE? VCL. THE DIFFERENCE BETWEEN THE TWO IS THAT ANDESITIC IS COMPOSED MOSTLY OF ANHEDRAL, EPI ALTERED AND MAGNETITE CLASTS, MATRIX SUPPORTED WHILE THE OTHER IS COMPOSED MOSTLY OF ANGULAR TO SUBANGULAR WHT-GREY QTZ CLASTS,POORLY SORTED, CLAST SUPPORTED SET IN A FINE GRAINED MATRIX WITH BLEBBY PYRITE ON MATRIX. FROM 343.71M TO 344.05, NOTED A POSSIBLY LATER QTZ VEIN/STOCKWORKS, GYPSUM NOTED TO BE WEAKLY REPLACING THE EDGES OF QTZ WITH 15% BLEBS OF PYRITE IN THE MATRIX GENERALLY, MINOR EPI+PY+-CCP NOTED AS WELL. WHT-GREY MASSIVE GYPSUM VEINS NOTED TO BE CUTTING BOTH LITHOLOGIES AND OBSERVED TO BE CUTTING THROUGH SOME OF THE EARLIER EPI+PY+-CCP VEINS, SOME OBSERVED TO BE DESTROYING THIS MINERALIZATION."
AXE-23-008,344.05,345.09,DIO,DIO,INT,MG,,,,"GREEN, MEDIUM GRAINED, PROPYLITIC ALT DIORITE ALT ASSEMBLAGE CHL>EPI>CARB PERVASIVE EPI ALT ON LIGHT MINERALS AND CHL ALT ON DARK MINERALS, CARB AS FRAC FILLS"
AXE-23-008,345.09,350.26,VCL,VCL,SVI,CG,,,,"GREEN TO GREY, WEAKLY PROP TO MOD SIL ALT VCL. MATRIX SUPPORTED, MOD SORTED, SUBROUNDED TO ROUNDED. CLASTS SIZE ~3-4MM COMPOSED OF SOME QTZ, PLAG AND MAGNETITE. SOME CLASTS ARE ALTERED TO EPIDOTE AND CHL. WITHIN THE INTERVAL, INTERCEPTED FROM 345.88M TO 346.52 A 0.65M OF MINERALIZED SECTION COMPOSED OF WHT MASSIVE GYPSUM STOCKWORKS AT THE START OF THIS INTERVAL - POSSIBLY REPLACING ORIGINAL STOCKWORK, ITS FOLLOWED BY VERY FINE GRAINED MASSIVE PY+-CCP AND MAGNETITE, ADDITIONALLY PY+CCP ON THE EDGES OF MAGNETITE AND ENDED IN ANOTHER WHT MASSIVE GYPSUM STOCKWORKS. BLEBS OF PYRITE WITHIN THE GYPUM STOCKWORKS OBSERVED. ADDITIONAL INTERCEPT OF 0.43M AND 0.56M, FROM 346.8M AND 348M (BOTTOM 60TCA) RESPECTIVELY - GREY-GREEN, SILICIFIED, HYDROTHERMAL BRECCIAS. MONOMICTIC, ANGULAR, CLAST SUPPORTED SET IN FINEGRAINED+QTZ MATRI WITH 10% BLEBBY PYRITE+-CCP. GYPSUM VEINS NOTED TO HAVE CUT THROUGH AND SOME OBSERVED TO BE REPLACING SOME OF THE QTZ."
AXE-23-008,,,,,,,,,,
AXE-23-008,350.26,359.05,VCL,VCL,SVI,CG,,,,"INTERCALATING BETWEEN MONZONITE BRECCIA AND ANDESITE BRECCIA. ANDESITE BRECCIA FROM 351.17 TO 351.71M, FOLLOWED BY MONZONITE HBX TO 353.18M. MONZONITE BRECCIA AGAIN FROM 354.17 TO 356.75M AND AGAIN FROM 358.54 TO 359.05M. THE MONZONITE BRECCIA IS GENERALLY MATRIX SUPPORTED, MONOMICTIC SUBANGULAR TO ANGULAR QTZ CLASTS SET IN FG GREEN MATRIX WITH 10% BLEBBY PYRITE, CUT BY WHT MASSIVE GYPSUM STOCKWORKS ANDESITE BRECCIA COMPOSED MOSTLY OF POLYMICTIC, ANHEDRAL, SUBROUNDED, CHL-EPI-MAG ALTERED CLASTS SET IN FG MATRIX - MATRIX SUPPORTED, FG PYRITE OBSERVED SEEM TO BE GENERALLY ONLY ON EPI ALT CLASTS. BOTH LITH ARE BEING CUT BY GYPSUM VEINLETS"
AXE-23-008,359.05,367.88,VCL,VCL,INT,CG,,,,"IT IS A COARSE-GRAINED, LIGHT GREY TO GREEN MATRIX-SUPPORTED MONZONITE BRECCIA. THE CLASTS ARE MAINLY COMPOSED OF WHITISH-GREY QUARTZ, SOME OF WHICH HAVE BEEN ALTERED TO A PINKISH COLOR, POSSIBLY INDICATING POTASSIUM FELDSPAR. THE CLASTS ARE SET IN A FINE-GRAINED, GREEN-COLORED MATRIX THAT CONSTITUTES APPROXIMATELY 20% OF THE ROCK'S COMPOSITION. THIS MATRIX CONTAINS SCATTERED BLEBBY PYRITE INCLUSIONS.THE BRECCIA IS CUT BY WHITE MASSIVE GYPSUM VEINS. FROM 449.23 TO 449.57, THERE IS AN OBSERVED HYDROTHERMAL BRECCIA WITH PROPYLITIC ALTERATION AND PERVASIVE SILICIFICATION. THE BRECCIA CONTAINS BLEBS OF PYRITE AND SOME CHALCOPYRITE. GYPSUM VEINS ARE THE PREDOMINANT FEATURE. INTERCEPTED WITHIN THIS INTERVAL THE ANDESITE CHL>EPI>MAG FROM 453.49 TO 458.56M POLYMICTIC VULCANOCLASTIC. WITHIN THIS INTERVAL, THERE IS AN ALTERNATING OCCURRENCE OF HYDROTHERMAL BRECCIAS THAT EXHIBIT CHALCOPYRITE BETWEEN DEPTHS OF 453.85 - 454.45 . FROM 456 TO 456.67, CHALCOPYRITE IS OBSERVED DISTRIBUTED BETWEEN MONZONITIC BRECCIA AND HYDROTHERMAL BRECCIA. 458.56-459.48 INTERVAL THE ANDESITE CHL>EPI>MAG POLYMICTIC VULCANOCLASTIC."
